{
  "schema_version": "3.0.0",
  "meta": {
    "generated_at": "2026-10-28T09:19:32",
    "mode": "kb",
    "engine": "python-kb",
    "engine_version": "3.0.0",
    "kb_version": "3.0.0",
    "graph_id": "KB-4-04-05-02",
    "workflow_file": "gangwei-nengli-tupu-20261027.langgraph.json",
    "workflow_steps": 7,
    "workflow_sha256": "a6d660dc039e05b03b46071645d76eac3cd450b756872b87ec14f935289ed43d",
    "workflow_nodes": [
      "start",
      "industry_chain_mapper",
      "task_analyzer",
      "competency_decomposer",
      "element_mapper",
      "graph_assembler",
      "end"
    ],
    "model": "offline"
  },
  "job": {
    "id": "JOB-4-04-05-02",
    "name": "计算机软件测试员",
    "code": "4-04-05-02",
    "level": "四级/中级工",
    "level_note": "能力条目取自 2024 年征求意见稿「四级/中级工」工作要求；权重取自同一文件的技能要求权重表。",
    "digital_occupation": true,
    "aliases": [
      "软件测试员",
      "测试工程师",
      "软件测试工程师",
      "QA工程师"
    ],
    "aliases_note": "后三个为行业常见称谓，用于检索，不代表职业标准中的职业名称。",
    "summary": "使用计算机及附属设备、测试工具、测试用例，验证计算机软件产品功能、性能及参数的人员。",
    "confidence": 0.85,
    "matched_by": "exact"
  },
  "industry_path": [
    {
      "level": "产业链",
      "id": "IND-SW",
      "name": "软件和信息技术服务业",
      "mapping_type": "teaching",
      "source_id": "TEACH-MAP-2026-01"
    },
    {
      "level": "产业链环节",
      "id": "IND-SW-QA",
      "name": "软件质量保障",
      "mapping_type": "teaching",
      "source_id": "TEACH-MAP-2026-01"
    },
    {
      "level": "职业岗位群",
      "id": "CLU-SW-QA",
      "name": "软件测试与质量保障岗位群",
      "mapping_type": "teaching",
      "source_id": "TEACH-MAP-2026-01"
    },
    {
      "level": "职业岗位",
      "id": "JOB-4-04-05-02",
      "name": "计算机软件测试员",
      "mapping_type": "standard",
      "source_id": "4-04-05-02"
    }
  ],
  "classification_path": [
    {
      "level": "职业大类",
      "name": "4 社会生产服务和生活服务人员"
    },
    {
      "level": "职业中类",
      "name": "4-04 信息传输、软件和信息技术服务人员"
    },
    {
      "level": "职业小类",
      "name": "4-04-05 软件和信息技术服务人员"
    },
    {
      "level": "职业细类",
      "name": "4-04-05-02 计算机软件测试员S"
    }
  ],
  "tasks": [
    {
      "id": "T11",
      "name": "使用功能测试用例等工具，测试计算机软件功能",
      "description": "使用功能测试用例等工具，测试计算机软件功能",
      "source": "SRC-CODEX 4-04-05-02 主要工作任务 1",
      "competency_ids": [
        "C1"
      ],
      "weight": 30.0,
      "importance": 4,
      "frequency": null,
      "difficulty": 3,
      "data_basis": {
        "importance": "derived_from_competency_weight",
        "difficulty": "derived_from_unit_level",
        "frequency": "not_in_standard"
      }
    },
    {
      "id": "T12",
      "name": "使用性能测试用例等工具，进行计算机软件负载测试和压力测试",
      "description": "使用性能测试用例等工具，进行计算机软件负载测试和压力测试",
      "source": "SRC-CODEX 4-04-05-02 主要工作任务 2",
      "competency_ids": [
        "C2"
      ],
      "weight": 20.0,
      "importance": 3,
      "frequency": null,
      "difficulty": 3,
      "data_basis": {
        "importance": "derived_from_competency_weight",
        "difficulty": "derived_from_unit_level",
        "frequency": "not_in_standard"
      }
    },
    {
      "id": "T13",
      "name": "使用计算机及附属设备，测试计算机软件的稳定性、兼容性等参数",
      "description": "使用计算机及附属设备，测试计算机软件的稳定性、兼容性等参数",
      "source": "SRC-CODEX 4-04-05-02 主要工作任务 3",
      "competency_ids": [
        "C3"
      ],
      "weight": 30.0,
      "importance": 4,
      "frequency": null,
      "difficulty": 3,
      "data_basis": {
        "importance": "derived_from_competency_weight",
        "difficulty": "derived_from_unit_level",
        "frequency": "not_in_standard"
      }
    },
    {
      "id": "T14",
      "name": "记录测试数据和案例",
      "description": "记录测试数据和案例",
      "source": "SRC-CODEX 4-04-05-02 主要工作任务 4",
      "competency_ids": [
        "C4"
      ],
      "weight": 10.0,
      "importance": 3,
      "frequency": null,
      "difficulty": 3,
      "data_basis": {
        "importance": "derived_from_competency_weight",
        "difficulty": "derived_from_unit_level",
        "frequency": "not_in_standard"
      }
    },
    {
      "id": "T15",
      "name": "编写、制作测试报告",
      "description": "编写、制作测试报告",
      "source": "SRC-CODEX 4-04-05-02 主要工作任务 5",
      "competency_ids": [
        "C4"
      ],
      "weight": 10.0,
      "importance": 3,
      "frequency": null,
      "difficulty": 3,
      "data_basis": {
        "importance": "derived_from_competency_weight",
        "difficulty": "derived_from_unit_level",
        "frequency": "not_in_standard"
      }
    }
  ],
  "domains": [
    {
      "id": "D1",
      "name": "功能测试",
      "weight": 30
    },
    {
      "id": "D2",
      "name": "性能测试",
      "weight": 20
    },
    {
      "id": "D3",
      "name": "其他测试",
      "weight": 30
    },
    {
      "id": "D4",
      "name": "测试文档编写",
      "weight": 20
    }
  ],
  "competencies": [
    {
      "id": "C1",
      "name": "功能测试",
      "domain_id": "D1",
      "weight": 30,
      "task_ids": [
        "T11"
      ],
      "source": "",
      "units": [
        {
          "id": "U11",
          "statement": "编写测试用例",
          "level": 2,
          "source": "SRC-STD-02 3.1 1.1",
          "skills": [
            {
              "id": "SK01",
              "name": "能根据需求文档编写测试用例"
            },
            {
              "id": "SK02",
              "name": "能识别测试用例优先级"
            }
          ],
          "knowledge": [
            {
              "id": "KP01",
              "name": "需求文档识读方法",
              "subject": "",
              "matched_point": "",
              "match_score": 0.143,
              "covered": false
            },
            {
              "id": "KP02",
              "name": "测试用例编写方法",
              "subject": "软件测试",
              "matched_point": "测试用例设计方法",
              "match_score": 0.667,
              "covered": true
            },
            {
              "id": "KP03",
              "name": "测试用例优先级定义方法",
              "subject": "",
              "matched_point": "",
              "match_score": 0.533,
              "covered": false
            }
          ]
        },
        {
          "id": "U12",
          "statement": "执行测试用例",
          "level": 2,
          "source": "SRC-STD-02 3.1 1.2",
          "skills": [
            {
              "id": "SK03",
              "name": "能配置管理测试环境"
            },
            {
              "id": "SK04",
              "name": "能执行测试用例"
            },
            {
              "id": "SK05",
              "name": "能完成回归测试"
            }
          ],
          "knowledge": [
            {
              "id": "KP04",
              "name": "测试环境配置管理方法",
              "subject": "",
              "matched_point": "",
              "match_score": 0.571,
              "covered": false
            },
            {
              "id": "KP05",
              "name": "测试任务单创建方法",
              "subject": "",
              "matched_point": "",
              "match_score": 0.364,
              "covered": false
            },
            {
              "id": "KP06",
              "name": "测试用例执行方法",
              "subject": "软件测试",
              "matched_point": "测试用例设计方法",
              "match_score": 0.667,
              "covered": true
            },
            {
              "id": "KP07",
              "name": "回归测试策略",
              "subject": "",
              "matched_point": "",
              "match_score": 0.4,
              "covered": false
            }
          ]
        },
        {
          "id": "U13",
          "statement": "功能测试记录",
          "level": 2,
          "source": "SRC-STD-02 3.1 1.3",
          "skills": [
            {
              "id": "SK06",
              "name": "能记录用例执行结果"
            },
            {
              "id": "SK07",
              "name": "能根据用例执行结果编写缺陷报告"
            }
          ],
          "knowledge": [
            {
              "id": "KP08",
              "name": "用例结果记录方法",
              "subject": "",
              "matched_point": "",
              "match_score": 0.333,
              "covered": false
            },
            {
              "id": "KP09",
              "name": "编写缺陷报告方法",
              "subject": "",
              "matched_point": "",
              "match_score": 0.4,
              "covered": false
            },
            {
              "id": "KP10",
              "name": "缺陷跟踪流程",
              "subject": "",
              "matched_point": "",
              "match_score": 0.4,
              "covered": false
            }
          ]
        }
      ]
    },
    {
      "id": "C2",
      "name": "性能测试",
      "domain_id": "D2",
      "weight": 20,
      "task_ids": [
        "T12"
      ],
      "source": "",
      "units": [
        {
          "id": "U21",
          "statement": "性能测试指标识别",
          "level": 2,
          "source": "SRC-STD-02 3.1 2.1",
          "skills": [
            {
              "id": "SK08",
              "name": "能识别软件需求说明书、产品需求文档中的性能指标"
            },
            {
              "id": "SK09",
              "name": "能识别客户端、服务器端的性能指标"
            }
          ],
          "knowledge": [
            {
              "id": "KP11",
              "name": "阅读、分析软件需求说明书、产品需求文档中的性能指标的方法",
              "subject": "",
              "matched_point": "",
              "match_score": 0.154,
              "covered": false
            },
            {
              "id": "KP12",
              "name": "客户端、服务器端的性能指标的定义",
              "subject": "",
              "matched_point": "",
              "match_score": 0.235,
              "covered": false
            }
          ]
        },
        {
          "id": "U22",
          "statement": "性能测试工具选型",
          "level": 2,
          "source": "SRC-STD-02 3.1 2.2",
          "skills": [
            {
              "id": "SK10",
              "name": "能识别性能测试工具"
            },
            {
              "id": "SK11",
              "name": "能根据场景选择性能测试工具"
            }
          ],
          "knowledge": [
            {
              "id": "KP13",